<?xml version="1.0" encoding="UTF-8"?>
<OrderList xmlns:xsi="http://www.w3.org/2001/XMLSchema-instance" xsi:noNamespaceSchemaLocation="order.xsd">
	<orderCount>7</orderCount>
<Order date="2014-6-15"><OrderId>2014615-4</OrderId><UserName>fujunbin</UserName><Product><MusicNumber>CD-4</MusicNumber><Amount>3</Amount></Product><Recipient><RecipientName>fujunbin</RecipientName><Address>asdf</Address><Zip>1234567</Zip><RecipientPhone>12345678901</RecipientPhone></Recipient><PaymentMethod>网银</PaymentMethod><Remark>a</Remark><Deliver>未派送</Deliver></Order><Order date="2014-6-15"><OrderId>2014615-5</OrderId><UserName>fujunbin</UserName><Recipient><RecipientName>fujunbin</RecipientName><Address>asdf</Address><Zip>1234567</Zip><RecipientPhone>12345678901</RecipientPhone></Recipient><PaymentMethod>网银</PaymentMethod><Remark>a</Remark><Deliver>未派送</Deliver></Order><Order date="2014-6-15"><OrderId>2014615-6</OrderId><UserName>fujunbin</UserName><Recipient><RecipientName/><Address/><Zip/><RecipientPhone/></Recipient><PaymentMethod/><Remark/><Deliver>未派送</Deliver></Order><Order date="2014-6-16"><OrderId>2014616-7</OrderId><UserName>fujunbin</UserName><Product><MusicNumber>CD-9</MusicNumber><Amount>3</Amount><MusicNumber>CD-10</MusicNumber><Amount>2</Amount></Product><Recipient><RecipientName>caijinkun</RecipientName><Address>华南理工大学</Address><Zip>510006</Zip><RecipientPhone>13660585607</RecipientPhone></Recipient><PaymentMethod>支付宝</PaymentMethod><Remark></Remark><Deliver>未派送</Deliver></Order></OrderList>
